{
  "skill": "qveris-10-risk-regime-review",
  "source_record": {
    "candidate_number": 10,
    "github_url": "https://github.com/tradermonty/claude-trading-skills",
    "license": "MIT",
    "evaluation_recent_activity": "2026-07-06",
    "local_source_snapshot": "third_party/source_repos/10-tradermonty-trading-skills",
    "snapshot_latest_commit": "4d63990 2026-07-05"
  },
  "controls": {
    "dry_run": false,
    "max_calls": 12,
    "max_age": "P1D",
    "budget_note": "Prioritize portfolio risk, regime, sector, and data-quality calls."
  },
  "analysis": {
    "workflow": "market_regime",
    "entity": "SPX",
    "summary": "Risk/regime review with sector rotation and data-quality checks.",
    "sections": [
      "portfolio_risk",
      "market_regime",
      "sector_rotation",
      "data_quality",
      "earnings_calendar"
    ]
  },
  "risk_notes": [
    "Monitoring output only; no trade prep or portfolio action instruction."
  ],
  "missing_fields": [],
  "qveris_trace": [
    {
      "tool_name": "qveris_finance.index_vix",
      "capability_id": "INDEX.VIX",
      "entity": "SPX",
      "market": "US",
      "params": {
        "lookback_days": 30
      },
      "as_of": "2026-07-06",
      "retrieved_at": "2026-07-06T00:00:00Z",
      "fallback_used": false,
      "missing_fields": []
    }
  ],
  "disclaimer": "不构成投资建议 / Not investment advice.",
  "data_quality": {
    "status": "ok",
    "warnings": [],
    "stale_fields": [],
    "out_of_window_events": [],
    "suppressed_fields": []
  },
  "suppressed_fields": []
}
