{
  "skill": "qveris-tech-earnings-deepdive",
  "source_record": {
    "candidate_number": 6,
    "github_url": "https://github.com/webleon/tech-earnings-deepdive-openclaw-skill",
    "license": "MIT",
    "evaluation_recent_activity": "2026-03-24",
    "local_source_snapshot": "third_party/source_repos/06-tech-earnings-deepdive",
    "snapshot_latest_commit": "5bff060 2026-03-24"
  },
  "controls": {
    "dry_run": false,
    "max_calls": 12,
    "max_age": "P1D",
    "budget_note": "Prioritize earnings, segment, transcript, and reaction calls."
  },
  "analysis": {
    "workflow": "tech_earnings_deepdive",
    "entity": "NVDA",
    "summary": "Evidence-first tech earnings memo with thesis and contrary evidence.",
    "sections": [
      "segment_scorecard",
      "management_commentary",
      "competition",
      "reaction",
      "risks"
    ]
  },
  "risk_notes": [
    "No position decision; memo is for research verification."
  ],
  "missing_fields": [],
  "qveris_trace": [
    {
      "tool_name": "qveris_finance.fundamentals_segment",
      "capability_id": "FUNDAMENTALS.SEGMENT",
      "entity": "NVDA",
      "market": "US",
      "params": {
        "period": "latest_quarter"
      },
      "as_of": "2026-07-06",
      "retrieved_at": "2026-07-06T00:00:00Z",
      "fallback_used": false,
      "missing_fields": []
    }
  ],
  "disclaimer": "不构成投资建议 / Not investment advice.",
  "data_quality": {
    "status": "ok",
    "warnings": [],
    "stale_fields": [],
    "out_of_window_events": [],
    "suppressed_fields": []
  },
  "suppressed_fields": []
}
