{
  "skill": "qveris-01-financial-services",
  "source_record": {
    "candidate_number": 1,
    "github_url": "https://github.com/anthropics/financial-services",
    "license": "Apache-2.0",
    "evaluation_recent_activity": "2026-06-26",
    "local_source_snapshot": "third_party/source_repos/01-anthropic-financial-services",
    "snapshot_latest_commit": "4aa51ed 2026-06-26"
  },
  "controls": {
    "dry_run": false,
    "max_calls": 12,
    "max_age": "P1D",
    "budget_note": "Stop after core earnings, fundamentals, and market calls; list omitted sections."
  },
  "analysis": {
    "workflow": "earnings_analysis",
    "entity": "NVDA",
    "summary": "Evidence-first earnings memo skeleton.",
    "sections": [
      "earnings_snapshot",
      "fundamental_drivers",
      "transcript_evidence",
      "market_reaction",
      "uncertainties"
    ]
  },
  "risk_notes": [
    "Scenario analysis only; no buy/sell instruction or target price commitment."
  ],
  "missing_fields": [],
  "qveris_trace": [
    {
      "tool_name": "qveris_finance.earnings_actual_surprise",
      "capability_id": "EARNINGS.ACTUAL_SURPRISE",
      "entity": "NVDA",
      "market": "US",
      "params": {
        "period": "latest"
      },
      "as_of": "2026-07-06",
      "retrieved_at": "2026-07-06T00:00:00Z",
      "fallback_used": false,
      "missing_fields": []
    }
  ],
  "disclaimer": "不构成投资建议 / Not investment advice.",
  "data_quality": {
    "status": "ok",
    "warnings": [],
    "stale_fields": [],
    "out_of_window_events": [],
    "suppressed_fields": []
  },
  "suppressed_fields": []
}
