{
  "skill": "qveris-04-factor-finance",
  "source_record": {
    "candidate_number": 4,
    "github_url": "https://github.com/himself65/finance-skills",
    "license": "MIT",
    "evaluation_recent_activity": "2026-06-14",
    "local_source_snapshot": "third_party/source_repos/04-finance-skills",
    "snapshot_latest_commit": "87f688e 2026-06-07"
  },
  "controls": {
    "dry_run": false,
    "max_calls": 10,
    "max_age": "P1D",
    "budget_note": "Prefer factor inputs with direct QVeris traces; omit optional factors when call budget is reached."
  },
  "analysis": {
    "workflow": "sentiment_factor",
    "entity": "TSLA",
    "summary": "Standardized factor output with value, direction, confidence, evidence, and missing fields.",
    "factors": [
      {
        "name": "news_sentiment",
        "direction": "mixed",
        "confidence": "medium"
      }
    ]
  },
  "risk_notes": [
    "Sentiment is explanatory context, not a return forecast."
  ],
  "missing_fields": [],
  "qveris_trace": [
    {
      "tool_name": "qveris_finance.sentiment_text_signals",
      "capability_id": "SENTIMENT.TEXT_SIGNALS",
      "entity": "TSLA",
      "market": "US",
      "params": {
        "lookback_days": 7
      },
      "as_of": "2026-07-06",
      "retrieved_at": "2026-07-06T00:00:00Z",
      "fallback_used": false,
      "missing_fields": []
    }
  ],
  "disclaimer": "不构成投资建议 / Not investment advice.",
  "data_quality": {
    "status": "ok",
    "warnings": [],
    "stale_fields": [],
    "out_of_window_events": [],
    "suppressed_fields": []
  },
  "suppressed_fields": []
}
