{
  "skill": "qveris-day1global-skills",
  "source_record": {
    "candidate_number": 7,
    "github_url": "https://github.com/star23/Day1Global-Skills",
    "license": "MIT",
    "evaluation_recent_activity": "2026-04-15",
    "local_source_snapshot": "third_party/source_repos/07-day1global-skills",
    "snapshot_latest_commit": "562c14b 2026-04-15"
  },
  "controls": {
    "dry_run": false,
    "max_calls": 12,
    "max_age": "P1D",
    "budget_note": "Prioritize company, market, fundamentals, estimates, and macro context."
  },
  "analysis": {
    "workflow": "global_tech_memo",
    "entity": "ASML",
    "summary": "Global technology memo with market, geography, and evidence sections.",
    "sections": [
      "company_context",
      "geography_backdrop",
      "drivers",
      "contrary_evidence",
      "risks"
    ]
  },
  "risk_notes": [
    "Template supports research framing, not a recommendation."
  ],
  "missing_fields": [],
  "qveris_trace": [
    {
      "tool_name": "qveris_finance.macro_indicators",
      "capability_id": "MACRO.INDICATORS",
      "entity": "ASML",
      "market": "EU",
      "params": {
        "region": "EU",
        "limit": 5
      },
      "as_of": "2026-07-06",
      "retrieved_at": "2026-07-06T00:00:00Z",
      "fallback_used": false,
      "missing_fields": []
    }
  ],
  "disclaimer": "不构成投资建议 / Not investment advice.",
  "data_quality": {
    "status": "ok",
    "warnings": [],
    "stale_fields": [],
    "out_of_window_events": [],
    "suppressed_fields": []
  },
  "suppressed_fields": []
}
