{
  "skill": "qveris-02-langalpha-dcf-earnings",
  "source_record": {
    "candidate_number": 2,
    "github_url": "https://github.com/ginlix-ai/LangAlpha",
    "license": "Apache-2.0",
    "evaluation_recent_activity": "2026-07-06",
    "local_source_snapshot": "third_party/source_repos/02-langalpha",
    "snapshot_latest_commit": "deab98e 2026-07-06"
  },
  "controls": {
    "dry_run": false,
    "max_calls": 10,
    "max_age": "P1D",
    "budget_note": "Prioritize fundamentals, consensus estimates, and rates before optional sector calls."
  },
  "analysis": {
    "workflow": "dcf_model",
    "entity": "MSFT",
    "summary": "DCF assumption audit with sensitivity ranges and missing-input disclosure.",
    "sections": [
      "input_audit",
      "base_assumptions",
      "sensitivity",
      "missing_data",
      "confidence"
    ]
  },
  "risk_notes": [
    "Valuation range is an analytical scenario, not a target price commitment."
  ],
  "missing_fields": [],
  "qveris_trace": [
    {
      "tool_name": "qveris_finance.fundamentals_cf",
      "capability_id": "FUNDAMENTALS.CF",
      "entity": "MSFT",
      "market": "US",
      "params": {
        "period": "annual",
        "limit": 5
      },
      "as_of": "2026-07-06",
      "retrieved_at": "2026-07-06T00:00:00Z",
      "fallback_used": false,
      "missing_fields": []
    }
  ],
  "disclaimer": "不构成投资建议 / Not investment advice.",
  "data_quality": {
    "status": "ok",
    "warnings": [],
    "stale_fields": [],
    "out_of_window_events": [],
    "suppressed_fields": []
  },
  "suppressed_fields": []
}
