{
  "skill": "qveris-eodhd-claude-skills",
  "source_record": {
    "candidate_number": 3,
    "github_url": "https://github.com/EodHistoricalData/eodhd-claude-skills",
    "license": "MIT",
    "evaluation_recent_activity": "2026-07-01",
    "local_source_snapshot": "third_party/source_repos/03-eodhd-claude-skills",
    "snapshot_latest_commit": "ab3034f 2026-06-22"
  },
  "controls": {
    "dry_run": false,
    "max_calls": 12,
    "max_age": "P1D",
    "budget_note": "Stop after company profile, quote, ratio, and news calls for company brief mode."
  },
  "analysis": {
    "workflow": "company_brief",
    "entity": "AAPL",
    "summary": "Company brief skeleton with profile, market data, ratios, and latest tagged news.",
    "sections": [
      "profile",
      "market_snapshot",
      "key_ratios",
      "news_context",
      "data_quality"
    ]
  },
  "risk_notes": [
    "Risk explanation only; no portfolio action instruction."
  ],
  "missing_fields": [],
  "qveris_trace": [
    {
      "tool_name": "qveris_finance.ref_company_profile",
      "capability_id": "REF.COMPANY_PROFILE",
      "entity": "AAPL",
      "market": "US",
      "params": {
        "symbol": "AAPL"
      },
      "as_of": "2026-07-06",
      "retrieved_at": "2026-07-06T00:00:00Z",
      "fallback_used": false,
      "missing_fields": []
    }
  ],
  "disclaimer": "不构成投资建议 / Not investment advice.",
  "data_quality": {
    "status": "ok",
    "warnings": [],
    "stale_fields": [],
    "out_of_window_events": [],
    "suppressed_fields": []
  },
  "suppressed_fields": []
}
