{
  "skill": "qveris-hhxg-market",
  "source_record": {
    "candidate_number": 9,
    "github_url": "https://github.com/Niceck/hhxg-top-hhxg-python",
    "license": "MIT",
    "evaluation_recent_activity": "2026-06-20",
    "local_source_snapshot": "third_party/source_repos/09-hhxg-market",
    "snapshot_latest_commit": "381d2c3 2026-06-20"
  },
  "controls": {
    "dry_run": false,
    "max_calls": 12,
    "max_age": "P1D",
    "budget_note": "Prioritize breadth, index, concepts, margin, news, and flow calls."
  },
  "analysis": {
    "workflow": "a_share_snapshot",
    "entity": "CN_A_SHARE",
    "summary": "A-share snapshot with JSON and markdown sections.",
    "sections": [
      "indices",
      "breadth",
      "top_movers",
      "concepts",
      "margin",
      "flows",
      "news_flash"
    ]
  },
  "risk_notes": [
    "News flashes must be marked by confirmation status and are not trading signals."
  ],
  "missing_fields": [],
  "qveris_trace": [
    {
      "tool_name": "qveris_finance.mkt_breadth_internals",
      "capability_id": "MKT.BREADTH_INTERNALS",
      "entity": "CN_A_SHARE",
      "market": "CN",
      "params": {
        "exchange": "SSE,SZSE"
      },
      "as_of": "2026-07-06",
      "retrieved_at": "2026-07-06T00:00:00Z",
      "fallback_used": false,
      "missing_fields": []
    }
  ],
  "disclaimer": "不构成投资建议 / Not investment advice.",
  "data_quality": {
    "status": "ok",
    "warnings": [],
    "stale_fields": [],
    "out_of_window_events": [],
    "suppressed_fields": []
  },
  "suppressed_fields": []
}
