{
  "skill": "qveris-earnings-tracker",
  "source_record": {
    "candidate_number": 8,
    "github_url": "https://github.com/Indomi/earnings-tracker",
    "license": "MIT",
    "evaluation_recent_activity": "2026-03-18",
    "local_source_snapshot": "third_party/source_repos/08-earnings-tracker",
    "snapshot_latest_commit": "38deb30 2026-03-19"
  },
  "controls": {
    "dry_run": false,
    "max_calls": 10,
    "max_age": "P1D",
    "budget_note": "Prioritize calendar and recap calls for watchlist names."
  },
  "analysis": {
    "workflow": "earnings_calendar",
    "entity": "watchlist",
    "summary": "Trace-backed earnings calendar and recap payload.",
    "sections": [
      "calendar",
      "industry_filter",
      "recap",
      "price_reaction"
    ]
  },
  "risk_notes": [
    "Calendar monitoring is not a trading signal."
  ],
  "missing_fields": [],
  "qveris_trace": [
    {
      "tool_name": "qveris_finance.event_calendar_earnings",
      "capability_id": "EVENT_CALENDAR.EARNINGS",
      "entity": "AAPL",
      "market": "US",
      "params": {
        "window_days": 14
      },
      "as_of": "2026-07-06",
      "retrieved_at": "2026-07-06T00:00:00Z",
      "fallback_used": false,
      "missing_fields": []
    }
  ],
  "disclaimer": "不构成投资建议 / Not investment advice.",
  "data_quality": {
    "status": "ok",
    "warnings": [],
    "stale_fields": [],
    "out_of_window_events": [],
    "suppressed_fields": []
  },
  "suppressed_fields": []
}
