{
  "skill": "qveris-11-financial-document-modeling",
  "source_record": {
    "candidate_number": 11,
    "github_url": "https://github.com/Ruinius/financial-analyst-skills",
    "license": "MIT",
    "evaluation_recent_activity": "2026-06-08",
    "local_source_snapshot": "third_party/source_repos/11-financial-analyst-skills",
    "snapshot_latest_commit": "e886093 2026-06-08"
  },
  "controls": {
    "dry_run": false,
    "max_calls": 12,
    "max_age": "P1D",
    "budget_note": "Prioritize filings, XBRL, fundamentals, and ratio calls."
  },
  "analysis": {
    "workflow": "financial_data_extraction",
    "entity": "META",
    "summary": "Trace-backed JSON extraction and calculation output.",
    "sections": [
      "document_index",
      "extracted_fields",
      "calculations",
      "model_inputs",
      "json_model"
    ]
  },
  "risk_notes": [
    "Local documents are fallback only and may contain private information."
  ],
  "missing_fields": [],
  "qveris_trace": [
    {
      "tool_name": "qveris_finance.filings_regulatory_metadata",
      "capability_id": "FILINGS.REGULATORY_METADATA",
      "entity": "META",
      "market": "US",
      "params": {
        "form": "10-K",
        "period": "latest"
      },
      "as_of": "2026-07-06",
      "retrieved_at": "2026-07-06T00:00:00Z",
      "fallback_used": false,
      "missing_fields": []
    }
  ],
  "disclaimer": "不构成投资建议 / Not investment advice.",
  "data_quality": {
    "status": "ok",
    "warnings": [],
    "stale_fields": [],
    "out_of_window_events": [],
    "suppressed_fields": []
  },
  "suppressed_fields": []
}
